{
  "data": [
    {
      "id": "b468110d-aebc-4af7-ae13-b96a9fe271d5",
      "name": "Primary Cluster 41",
      "folder": "example-folder",
      "static": [
        "example-static_item"
      ],
      "dynamic": {
        "filter": "example-filter"
      },
      "description": "Analysis for for policy suspicious on.",
      "tag": [
        "critical-asset"
      ]
    }
  ],
  "offset": 461,
  "total": 573,
  "limit": 926
}
